Cites,Authors,Title,Year,Source,Publisher,ArticleURL,CitesURL,GSRank,QueryDate,Type,DOI,ISSN,CitationURL,Volume,Issue,StartPage,EndPage,ECC,CitesPerYear,CitesPerAuthor,AuthorCount,Age,Abstract,FullTextURL,RelatedURL
2,"SB Rakočević, N Rakić","The Future of Banking in FinTech Era: Decentralized and Embedded Finance",2023,"Digital Transformation of the Financial Industry …","Springer","https://link.springer.com/chapter/10.1007/978-3-031-23269-5_6","https://scholar.google.com/scholar?cites=1754299001317893352&as_sdt=2005&sciodt=0,5&hl=en",473,"2024-07-30 23:13:48","","10.1007/978-3-031-23269-5_6","","",,,,,2,2.00,1,2,1,"… about DeFi—decentralized finance, because of the FinTech influence on the financial system. Basically, DeFi … Decentralized financial services could have existed in merit to blockchain …","","https://scholar.google.com/scholar?q=related:6CRgo6WFWBgJ:scholar.google.com/&scioq=defi%7Cdecentralized+finance&hl=en&as_sdt=0,5"
0,"A Ed-Daoudy, C Ahmed","Financial Inclusion of Moroccan Smes: Assessing Fintech's Adoption and Exploring Decentralized Finance Perceptions in Morocco",2024,"Available at SSRN 4683911","papers.ssrn.com","https://papers.ssrn.com/sol3/papers.cfm?abstract_id=4683911","",474,"2024-07-30 23:13:48","","","","",,,,,0,0.00,0,2,1,"… technology and their perception of decentralized finance, we have noted that 77% of the 419 surveyed population has not been exposed to the term ""DeFi"" or decentralized finance, as …","https://www.scirp.org/journal/paperinformation?paperid=131763","https://scholar.google.com/scholar?q=related:B1YZ83ZWSswJ:scholar.google.com/&scioq=defi%7Cdecentralized+finance&hl=en&as_sdt=0,5"
7,"W Zeng, E Pradhan, M Khanna, ...","Cost-effectiveness analysis of the decentralized facility financing and performance-based financing program in Nigeria",2022,"Journal of Hospital …","jhmhp.amegroups.org","https://jhmhp.amegroups.org/article/view/6956/html","https://scholar.google.com/scholar?cites=16449307802147141952&as_sdt=2005&sciodt=0,5&hl=en",475,"2024-07-30 23:13:48","HTML","","","",,,,,7,3.50,2,4,2,"Background: Nigeria piloted decentralized facility financing (DFF) and performance-based financing (PBF) programs under the Nigeria State Health Investment Project (NSHIP), funded …","https://jhmhp.amegroups.org/article/view/6956/html","https://scholar.google.com/scholar?q=related:QLkKPEuuR-QJ:scholar.google.com/&scioq=defi%7Cdecentralized+finance&hl=en&as_sdt=0,5"
2,"M Shapsugova","Decentralized energy: a prerequisite for the distribution of decentralized technology",2023,"E3S Web of Conferences","e3s-conferences.org","https://www.e3s-conferences.org/articles/e3sconf/abs/2023/39/e3sconf_transsiberia2023_05013/e3sconf_transsiberia2023_05013.html","https://scholar.google.com/scholar?cites=8664230740218125443&as_sdt=2005&sciodt=0,5&hl=en",476,"2024-07-30 23:13:48","","","","",,,,,2,2.00,2,1,1,"… between decentralized energy and the distribution of decentralized … Decentralized finance (DeFi) is an area that is rapidly … DeFi leverages decentralized technology to create financial …","https://www.e3s-conferences.org/articles/e3sconf/pdf/2023/39/e3sconf_transsiberia2023_05013.pdf","https://scholar.google.com/scholar?q=related:g5y4AvSHPXgJ:scholar.google.com/&scioq=defi%7Cdecentralized+finance&hl=en&as_sdt=0,5"
4,"T Lim","Predictive crypto-asset automated market making architecture for decentralized finance using deep reinforcement learning",2022,"arXiv preprint arXiv:2211.01346","arxiv.org","https://arxiv.org/abs/2211.01346","https://scholar.google.com/scholar?cites=2333187286685247201&as_sdt=2005&sciodt=0,5&hl=en",477,"2024-07-30 23:13:48","","","","",,,,,4,2.00,4,1,2,"… This is also known as decentralised finance (DeFi). DEX represents an important element of the DeFi market structure. Prior to the advent of decentralized exchanges (DEX) in recent …","https://arxiv.org/pdf/2211.01346","https://scholar.google.com/scholar?q=related:4eZUuXklYSAJ:scholar.google.com/&scioq=defi%7Cdecentralized+finance&hl=en&as_sdt=0,5"
98,"C Bellavitis, C Fisch, PP Momtaz","The rise of decentralized autonomous organizations (DAOs): a first empirical glimpse",2023,"Venture Capital","Taylor &Francis","https://www.tandfonline.com/doi/abs/10.1080/13691066.2022.2116797","https://scholar.google.com/scholar?cites=616527720533007096&as_sdt=2005&sciodt=0,5&hl=en",478,"2024-07-30 23:13:48","","10.1080/13691066.2022.2116797","","",,,,,98,98.00,33,3,1,"… For example, Cook Finance, a two-sided DeFi index platform, requires its members to hold five million COOK tokens to make a proposal, which corresponds to almost USD 10,000.…","https://www.researchgate.net/profile/Paul-Momtaz/publication/363155263_The_rise_of_decentralized_autonomous_organizations_DAOs_a_first_empirical_glimpse/links/64151b7f92cfd54f840cbc9d/The-rise-of-decentralized-autonomous-organizations-DAOs-a-first-empirical-glimpse.pdf","https://scholar.google.com/scholar?q=related:-BqNALJYjggJ:scholar.google.com/&scioq=defi%7Cdecentralized+finance&hl=en&as_sdt=0,5"
101,"Y Faqir-Rhazoui, J Arroyo, S Hassan","A comparative analysis of the platforms for decentralized autonomous organizations in the Ethereum blockchain",2021,"Journal of Internet Services and …","Springer","https://link.springer.com/article/10.1186/s13174-021-00139-6","https://scholar.google.com/scholar?cites=18341456330557332913&as_sdt=2005&sciodt=0,5&hl=en",479,"2024-07-30 23:13:48","HTML","10.1186/s13174-021-00139-6","","",,,,,101,33.67,34,3,3,"… fields [20, 21], specially on Finance. Thus, we may highlight … surge of Decentralized Finance (DeFi), a form of finance that … Beyond Finance, we may mention IoT, using blockchain as a …","https://link.springer.com/article/10.1186/s13174-021-00139-6","https://scholar.google.com/scholar?q=related:sZ01_lrxif4J:scholar.google.com/&scioq=defi%7Cdecentralized+finance&hl=en&as_sdt=0,5"
0,"M Kaiser","From scalability to cross-chain DeFi",2024,"The Elgar Companion to Decentralized Finance, Digital …","elgaronline.com","https://www.elgaronline.com/edcollchap/book/9781035307760/book-part-9781035307760-18.xml","",480,"2024-07-30 23:13:48","","","","",,,,,0,0.00,0,1,1,"… ecosystems in general and for the decentralized financial sector; and (2) to … of decentralized finance. Finally, a potential outlook for the future of cross-chain decentralized finance (DeFi) …","","https://scholar.google.com/scholar?q=related:6EFR6xKPJtMJ:scholar.google.com/&scioq=defi%7Cdecentralized+finance&hl=en&as_sdt=0,5"
0,"L Ramachandran, S Shanthana, ...","Decentralized Financial Stocks Prediction Using Deep Regression Learning",2024,"2024 2nd …","ieeexplore.ieee.org","https://ieeexplore.ieee.org/abstract/document/10489361/","",481,"2024-07-30 23:13:48","","","","",,,,,0,0.00,0,3,1,"… now as a result of decentralised finance (DeFi), which offers … Decentralised finance is characterised by its decentralised … of specialist approaches for predicting DeFi stock prices. The …","","https://scholar.google.com/scholar?q=related:06YB1g5L4xEJ:scholar.google.com/&scioq=defi%7Cdecentralized+finance&hl=en&as_sdt=0,5"
10,"N Augustin, A Eckhardt, AW de Jong","Understanding decentralized autonomous organizations from the inside",2023,"Electronic Markets","Springer","https://link.springer.com/article/10.1007/s12525-023-00659-y","https://scholar.google.com/scholar?cites=8881927426212856606&as_sdt=2005&sciodt=0,5&hl=en",482,"2024-07-30 23:13:48","HTML","10.1007/s12525-023-00659-y","","",,,,,10,10.00,3,3,1,"… Having understood the core concept of DAOs, we present additional contextual features such as the most named use cases in the context of DAOs, namely decentralized finance (DeFi) …","https://link.springer.com/article/10.1007/s12525-023-00659-y","https://scholar.google.com/scholar?q=related:HoM3iO_xQnsJ:scholar.google.com/&scioq=defi%7Cdecentralized+finance&hl=en&as_sdt=0,5"
0,"NG Packin, Y Lev‐Aretz","Decentralized credit scoring: Black box 3.0",2024,"American Business Law Journal","Wiley Online Library","https://onlinelibrary.wiley.com/doi/abs/10.1111/ablj.12240","",483,"2024-07-30 23:13:48","","10.1111/ablj.12240","","",,,,,0,0.00,0,2,1,"… Much like traditional credit scoring, decentralized credit scoring calculates a borrower's … on the blockchain by Decentralized Finance (DeFi) platforms. Originally, DeFi emerged as an …","","https://scholar.google.com/scholar?q=related:db23qF_KC4sJ:scholar.google.com/&scioq=defi%7Cdecentralized+finance&hl=en&as_sdt=0,5"
0,"M Parasol","Enforcing Persistent"" Smart Contracts"": Admin Keys and the Myth of Decentralized Finance?",2022,"NCJL &Tech.","HeinOnline","https://heinonline.org/hol-cgi-bin/get_pdf.cgi?handle=hein.journals/ncjl24&section=28","",484,"2024-07-30 23:13:48","","","","",,,,,0,0.00,0,1,2,"… This Article also focuses upon decentralized smart contracts that utilize distributed ledger technology to facilitate the automated execution of an agreement. Contracts can be entirely or …","","https://scholar.google.com/scholar?q=related:JnqFO6CiaicJ:scholar.google.com/&scioq=defi%7Cdecentralized+finance&hl=en&as_sdt=0,5"
2,"EM Arvanitou, D Gagoutis, A Ampatzoglou, ...","What does matter in the success of a decentralized application? From idea to development",2024,"Information and …","Elsevier","https://www.sciencedirect.com/science/article/pii/S0950584924000193","https://scholar.google.com/scholar?cites=16053201124861664567&as_sdt=2005&sciodt=0,5&hl=en",485,"2024-07-30 23:13:48","","","","",,,,,2,2.00,1,4,1,"… running in a decentralized manner, covering the needs of various end-users. Decentralized … popular in numerous application domains, ranging from finance to games, and from Non-…","","https://scholar.google.com/scholar?q=related:N91Hm15tyN4J:scholar.google.com/&scioq=defi%7Cdecentralized+finance&hl=en&as_sdt=0,5"
2,"Y Bonaparte","Cryptocurrency, Decentralized Finance Blockchains and Robust Trading Strategies",2022,"","books.google.com","https://books.google.com/books?hl=en&lr=&id=4uCTEAAAQBAJ&oi=fnd&pg=PP5&dq=defi%7Cdecentralized+finance&ots=gjDNCax99B&sig=Tm9lAWYU4NmK_6DkwpSdxlVde54","https://scholar.google.com/scholar?cites=12043303558348862953&as_sdt=2005&sciodt=0,5&hl=en",486,"2024-07-30 23:13:48","BOOK","","","",,,,,2,1.00,2,1,2,"… Collectively, this book discusses the origin of money, the role of finance, technologies that offer possibilities, and the present and the future of cryptocurrency and Defi blockchain. …","","https://scholar.google.com/scholar?q=related:6fWUNcdoIqcJ:scholar.google.com/&scioq=defi%7Cdecentralized+finance&hl=en&as_sdt=0,5"
7,"DS Paauw","The case for decentralized financing of economic development in Indonesia",1955,"The Journal of Asian Studies","cambridge.org","https://www.cambridge.org/core/journals/journal-of-asian-studies/article/case-for-decentralized-financing-of-economic-development-in-indonesia/E4711467DDC3222A67903ABA94628EFE","https://scholar.google.com/scholar?cites=13131480180601748599&as_sdt=2005&sciodt=0,5&hl=en",487,"2024-07-30 23:13:48","","","","",,,,,7,0.10,7,1,69,"… The problems and potentialities of decentralized financing of development can be clarified … of Javanese local finance. To provide a contrast between Javanese local finance and that in …","","https://scholar.google.com/scholar?q=related:d3zZk6ZjPLYJ:scholar.google.com/&scioq=defi%7Cdecentralized+finance&hl=en&as_sdt=0,5"
96,"F Victor, AM Weintraud","Detecting and quantifying wash trading on decentralized cryptocurrency exchanges",2021,"Proceedings of the Web Conference 2021","dl.acm.org","https://dl.acm.org/doi/abs/10.1145/3442381.3449824","https://scholar.google.com/scholar?cites=1713206329711902141&as_sdt=2005&sciodt=0,5&hl=en",488,"2024-07-30 23:13:48","","10.1145/3442381.3449824","","",,,,,96,32.00,48,2,3,"… the umbrella term Decentralized Finance (DeFi) are … decentralized way, excluding middlemen as far as possible. … As the number of different DeFi services increases, so does the com…","https://arxiv.org/pdf/2102.07001","https://scholar.google.com/scholar?q=related:vb1tdRSIxhcJ:scholar.google.com/&scioq=defi%7Cdecentralized+finance&hl=en&as_sdt=0,5"
553,"D Puthal, N Malik, SP Mohanty, ...","The blockchain as a decentralized security framework [future directions]",2018,"IEEE Consumer …","ieeexplore.ieee.org","https://ieeexplore.ieee.org/abstract/document/8287055/","https://scholar.google.com/scholar?cites=4764942049635213308&as_sdt=2005&sciodt=0,5&hl=en",489,"2024-07-30 23:13:48","","","","",,,,,553,92.17,138,4,6,"… The technology provides a new way of managing trust and can be effectively applied in insur ance and domains like finance, as pre sented in Figure 4 [10]. It eliminates the involvement …","https://cics.unt.edu/sites/default/files/basic_documents/Blockchain_As_Decentralized_Security_Framework.pdf","https://scholar.google.com/scholar?q=related:_B_UY4x5IEIJ:scholar.google.com/&scioq=defi%7Cdecentralized+finance&hl=en&as_sdt=0,5"
11,"CH Chao, IH Ting, YJ Tseng, BW Wang, ...","The study of decentralized autonomous organization (DAO) in social network",2022,"Proceedings of the 9th …","dl.acm.org","https://dl.acm.org/doi/abs/10.1145/3561278.3561293","https://scholar.google.com/scholar?cites=14340033965128617423&as_sdt=2005&sciodt=0,5&hl=en",490,"2024-07-30 23:13:48","","10.1145/3561278.3561293","","",,,,,11,5.50,2,5,2,"… 2.4 Decentralized Finance (DeFi) Decentralized Finance (DeFi) is an innovative decentralized … DeFi is a peer-to-peer financial model that utilizes blockchain-based smart contracts to …","","https://scholar.google.com/scholar?q=related:zw2HHuoIAscJ:scholar.google.com/&scioq=defi%7Cdecentralized+finance&hl=en&as_sdt=0,5"
150,"A Murray, D Kim, J Combs","The promise of a decentralized internet: What is Web3 and how can firms prepare?",2023,"Business Horizons","Elsevier","https://www.sciencedirect.com/science/article/pii/S0007681322000714","https://scholar.google.com/scholar?cites=17913859355178135992&as_sdt=2005&sciodt=0,5&hl=en",491,"2024-07-30 23:13:48","","","","",,,,,150,150.00,50,3,1,"… financial systems on blockchain: decentralized finance (DeFi). DeFi allows any individual or … decentralized exchanges (DEXs), such as Uniswap or Sushiswap. DEXs support a robust …","https://www.researchgate.net/profile/Alex-Murray/publication/360977595_The_Promise_of_a_Decentralized_Internet_What_is_Web_30_and_How_Can_Firms_Prepare/links/629663c755273755ebc63d6b/The-Promise-of-a-Decentralized-Internet-What-is-Web-30-and-How-Can-Firms-Prepare.pdf","https://scholar.google.com/scholar?q=related:uHGz_SvQmvgJ:scholar.google.com/&scioq=defi%7Cdecentralized+finance&hl=en&as_sdt=0,5"
26,"I Ghosh, E Alfaro-Cortés, M Gámez, ...","Prediction and interpretation of daily NFT and DeFi prices dynamics: Inspection through ensemble machine learning &XAI",2023,"International Review of …","Elsevier","https://www.sciencedirect.com/science/article/pii/S1057521923000741","https://scholar.google.com/scholar?cites=6880948893147083321&as_sdt=2005&sciodt=0,5&hl=en",492,"2024-07-30 23:13:48","HTML","","","",,,,,26,26.00,7,4,1,"… (NFT) and Decentralized Finance (DeFi) assets have seen a … dynamics of NFT and DeFi coins motivates the scrupulous … majority of the NFT and DeFi coins during the ongoing financial …","https://www.sciencedirect.com/science/article/pii/S1057521923000741","https://scholar.google.com/scholar?q=related:OTKmvY8Kfl8J:scholar.google.com/&scioq=defi%7Cdecentralized+finance&hl=en&as_sdt=0,5"
2,"M Schaible","Decentralized lending: Empirical analysis of interest and liquidation mechanisms",2022,"","books.google.com","https://books.google.com/books?hl=en&lr=&id=5TWFEAAAQBAJ&oi=fnd&pg=PR5&dq=defi%7Cdecentralized+finance&ots=f5Lnn_FJyG&sig=YrsQ1m7NpNK_FlfXcsPNNeYB9OA","https://scholar.google.com/scholar?cites=9077567250127677149&as_sdt=2005&sciodt=0,5&hl=en",493,"2024-07-30 23:13:48","BOOK","","","",,,,,2,1.00,2,1,2,"… an overview of how decentralized loans work and how the … general architecture of Decentralized Finance, are highlighted… With the introduction of Decentralized Finance (DeFi), …","","https://scholar.google.com/scholar?q=related:3WaUqFH_-X0J:scholar.google.com/&scioq=defi%7Cdecentralized+finance&hl=en&as_sdt=0,5"
3,"F Ghazzawi, Y Yanovich","Data mining of uniswap decentralized exchange",2022,"Proceedings of the 2022 5th International …","dl.acm.org","https://dl.acm.org/doi/abs/10.1145/3581971.3581975","https://scholar.google.com/scholar?cites=2525921711786354376&as_sdt=2005&sciodt=0,5&hl=en",494,"2024-07-30 23:13:48","","10.1145/3581971.3581975","","",,,,,3,1.50,2,2,2,"… The data from decentralized finance services is openly available once they operate in public blockchains. Although data encryption techniques for transaction exist, they are challenging…","","https://scholar.google.com/scholar?q=related:yOZ4-WngDSMJ:scholar.google.com/&scioq=defi%7Cdecentralized+finance&hl=en&as_sdt=0,5"
0,"P Grimberg","Empirical Analysis of Arbitrage Strategies in Centralized Cryptocurrency Exchanges and Its Applications to Decentralized Finance",2022,"","search.proquest.com","https://search.proquest.com/openview/6f9771de378b00f9f1540cf8a4affc13/1?pq-origsite=gscholar&cbl=18750&diss=y","",495,"2024-07-30 23:13:48","","","","",,,,,0,0.00,0,1,2,"… With the recent development of cryptocurrency derivatives and Decentralized Finance (DeFi), we hypothesize that new arbitrage opportunities will emerge and an automated trading …","","https://scholar.google.com/scholar?q=related:QOAso1IxCQMJ:scholar.google.com/&scioq=defi%7Cdecentralized+finance&hl=en&as_sdt=0,5"
5,"B Charoenwong, RM Kirby, J Reiter","Decentralized Stablecoin Design",2022,"Available at SSRN 4202600","papers.ssrn.com","https://papers.ssrn.com/sol3/papers.cfm?abstract_id=4202600","https://scholar.google.com/scholar?cites=1109798162166768595&as_sdt=2005&sciodt=0,5&hl=en",496,"2024-07-30 23:13:48","","","","",,,,,5,2.50,2,3,2,"… We explore what new functionality decentralized stablecoins offer and address several … “stablecoins” in decentralized finance (DeFi). As assets that attempt to connect the DeFi world to …","","https://scholar.google.com/scholar?q=related:0-NUbIzLZg8J:scholar.google.com/&scioq=defi%7Cdecentralized+finance&hl=en&as_sdt=0,5"
76,"W Dillinger, M Fay","From centralized to decentralized governance",1999,"Finance and Development","search.proquest.com","https://search.proquest.com/openview/7b8de48a7d3e195b5445b46aa23e383c/1?pq-origsite=gscholar&cbl=1819673","https://scholar.google.com/scholar?cites=8269798428938439306&as_sdt=2005&sciodt=0,5&hl=en",497,"2024-07-30 23:13:48","","","","",,,,,76,3.04,38,2,25,"… assignment is straightforward: finance should follow function. … decentralized services has declined sharply. The opposite occurred in much of Latin America: governments decentralized …","","https://scholar.google.com/scholar?q=related:ior1GNs5xHIJ:scholar.google.com/&scioq=defi%7Cdecentralized+finance&hl=en&as_sdt=0,5"
10,"M Zichichi, L Serena, S Ferretti, ...","Governing decentralized complex queries through a dao",2021,"Proceedings of the …","dl.acm.org","https://dl.acm.org/doi/abs/10.1145/3462203.3475910","https://scholar.google.com/scholar?cites=7395721168898226198&as_sdt=2005&sciodt=0,5&hl=en",498,"2024-07-30 23:13:48","","10.1145/3462203.3475910","","",,,,,10,3.33,3,4,3,"… For instance, the first use case on DeFi is generally applicable to different DAOs … A DeFi-based rewarding system. Decentralized finance (DeFi) is a term that refers to novel P2P financial …","https://arxiv.org/pdf/2107.06790","https://scholar.google.com/scholar?q=related:FvgDCjjhomYJ:scholar.google.com/&scioq=defi%7Cdecentralized+finance&hl=en&as_sdt=0,5"
0,"S Sarumathi, AR Saxena, YR Saxena, ...","Decentralized Finance and Cross-Chain Interoperable Automated Market Maker-Using BlockChain",2024,"… on Emerging Trends …","ieeexplore.ieee.org","https://ieeexplore.ieee.org/abstract/document/10493513/","",499,"2024-07-30 23:13:48","","","","",,,,,0,0.00,0,4,1,"… In this paper, we introduce Mixta as an innovative force in decentralized finance (DeFi), operating exclusively on the Ethereum Blockchain. Mixta strategically integrates Automated …","","https://scholar.google.com/scholar?q=related:OcJzeOC29QEJ:scholar.google.com/&scioq=defi%7Cdecentralized+finance&hl=en&as_sdt=0,5"
4,"E Livni, E Lipton","Crypto Banking and Decentralized Finance Explained",2021,"The New York Times","businessforum.com","http://www.businessforum.com/NYT_09-05-2021.pdf","https://scholar.google.com/scholar?cites=8105747216657128303&as_sdt=2005&sciodt=0,5&hl=en",500,"2024-07-30 23:13:48","PDF","","","",,,,,4,1.33,2,2,3,"… Compound, a decentralized, automated lending and … , loosely describes an alternative finance ecosystem where … The DeFi movement aims to “disintermediate” finance, using …","http://www.businessforum.com/NYT_09-05-2021.pdf","https://scholar.google.com/scholar?q=related:b5v1vyVmfXAJ:scholar.google.com/&scioq=defi%7Cdecentralized+finance&hl=en&as_sdt=0,5"
7,"W Kaal","Reputation as capital—How Decentralized Autonomous Organizations address shortcomings in the venture capital market",2023,"Journal of Risk and Financial Management","mdpi.com","https://www.mdpi.com/1911-8074/16/5/263","https://scholar.google.com/scholar?cites=4394839813101208909&as_sdt=2005&sciodt=0,5&hl=en",501,"2024-07-30 23:13:48","HTML","","","",,,,,7,7.00,7,1,1,"Venture capital (VC) models can be optimized with emerging decentralized technology. … of VC businesses that are operated by a Decentralized Autonomous Organization (DAO). More …","https://www.mdpi.com/1911-8074/16/5/263","https://scholar.google.com/scholar?q=related:TUWkcIab_TwJ:scholar.google.com/&scioq=defi%7Cdecentralized+finance&hl=en&as_sdt=0,5"
44,"R Fritsch, M Müller, R Wattenhofer","Analyzing voting power in decentralized governance: Who controls DAOs?",2024,"Blockchain: Research and Applications","Elsevier","https://www.sciencedirect.com/science/article/pii/S2096720924000216","https://scholar.google.com/scholar?cites=1856361192405991416&as_sdt=2005&sciodt=0,5&hl=en",502,"2024-07-30 23:13:48","HTML","","","",,,,,44,44.00,15,3,1,"… Some early analyses of the systems, mainly focussing on the ownership distribution of governance tokens of decentralized finance (DeFi) protocols, have been carried out in [12], [13], […","https://www.sciencedirect.com/science/article/pii/S2096720924000216","https://scholar.google.com/scholar?q=related:-P8tSKsewxkJ:scholar.google.com/&scioq=defi%7Cdecentralized+finance&hl=en&as_sdt=0,5"
83,"A Barbon, A Ranaldo","On the quality of cryptocurrency markets: Centralized versus decentralized exchanges",2021,"arXiv preprint arXiv:2112.07386","arxiv.org","https://arxiv.org/abs/2112.07386","https://scholar.google.com/scholar?cites=8212488577837379829&as_sdt=2005&sciodt=0,5&hl=en",503,"2024-07-30 23:13:48","","","","",,,,,83,27.67,42,2,3,"… We add to the literature by studying liquidity in centralized and decentralized crypto exchanges. Finally, we contribute to the new literature on decentralized exchanges. So far, theo…","https://arxiv.org/pdf/2112.07386","https://scholar.google.com/scholar?q=related:9TDzk9me-HEJ:scholar.google.com/&scioq=defi%7Cdecentralized+finance&hl=en&as_sdt=0,5"
24,"J Rodden","Decentralized rule and revenue",2016,"","Cambridge University Press","","https://scholar.google.com/scholar?cites=9335273575095333793&as_sdt=2005&sciodt=0,5&hl=en",504,"2024-07-30 23:13:48","CITATION","","","",,,,,24,3.00,24,1,8,"","http://www.jonathanrodden.com/s/jr_finance_FINAL-x5zs.pdf","https://scholar.google.com/scholar?q=related:ofOlLNuNjYEJ:scholar.google.com/&scioq=defi%7Cdecentralized+finance&hl=en&as_sdt=0,5"
3184,"JC Stein","Information production and capital allocation: Decentralized versus hierarchical firms",2002,"The journal of finance","Wiley Online Library","https://onlinelibrary.wiley.com/doi/abs/10.1111/0022-1082.00483","https://scholar.google.com/scholar?cites=2061331846432436281&as_sdt=2005&sciodt=0,5&hl=en",505,"2024-07-30 23:13:48","","10.1111/0022-1082.00483","","",,,,,3184,144.73,3184,1,22,"This paper asks how well different organizational structures perform in terms of generating information about investment projects and allocating capital to these projects. A decentralized …","https://www.nber.org/system/files/working_papers/w7705/w7705.pdf","https://scholar.google.com/scholar?q=related:OTDOlmRSmxwJ:scholar.google.com/&scioq=defi%7Cdecentralized+finance&hl=en&as_sdt=0,5"
0,"A Stanger","Are Cryptocurrencies and Decentralized Finance Democratic?",2023,"Introduction to Digital Humanism: A Textbook","library.oapen.org","https://library.oapen.org/bitstream/handle/20.500.12657/87619/1/978-3-031-45304-5.pdf#page=507","",506,"2024-07-30 23:13:48","PDF","","","",,,,,0,0.00,0,1,1,"… , decentralized finance is the engine of opportunity for the Web3 ecosystem. Decentralized finance, also known as DeFi, … It aims to democratize finance, at least in theory, by replacing …","https://library.oapen.org/bitstream/handle/20.500.12657/87619/1/978-3-031-45304-5.pdf#page=507","https://scholar.google.com/scholar?q=related:sDVJ6gRm-PQJ:scholar.google.com/&scioq=defi%7Cdecentralized+finance&hl=en&as_sdt=0,5"
