Cites,Authors,Title,Year,Source,Publisher,ArticleURL,CitesURL,GSRank,QueryDate,Type,DOI,ISSN,CitationURL,Volume,Issue,StartPage,EndPage,ECC,CitesPerYear,CitesPerAuthor,AuthorCount,Age,Abstract,FullTextURL,RelatedURL
1301,"WE Oates","Fiscal decentralization and economic development",1993,"National tax journal","journals.uchicago.edu","https://www.journals.uchicago.edu/doi/abs/10.1086/NTJ41789013","https://scholar.google.com/scholar?cites=2226650768508078388&as_sdt=2005&sciodt=0,5&hl=en",742,"2024-07-30 23:13:48","","10.1086/NTJ41789013","","",,,,,1301,41.97,1301,1,31,"… questions of the operation of decentralized finance, but they are clearly matters of great importance. While there is a compelling case, in principle, for decentralized finance, the case is …","","https://scholar.google.com/scholar?q=related:NEnGnxOn5h4J:scholar.google.com/&scioq=defi%7Cdecentralized+finance&hl=en&as_sdt=0,5"
0,"DJ Cumming, N Dombrowski, W Drobetz, ...","Financing Decentralized Digital Platform Growth: The Role of Crypto Funds in Blockchain-based Startups",2024,"Available at SSRN …","papers.ssrn.com","https://papers.ssrn.com/sol3/papers.cfm?abstract_id=4759395","",743,"2024-07-30 23:13:48","","","","",,,,,0,0.00,0,4,1,"Coordination frictions may prevent the efficient adoption and governance of digital platforms. We document that crypto funds (CFs) create value, inter alia, by smoothing such frictions on …","","https://scholar.google.com/scholar?q=related:nBIWHspdXkIJ:scholar.google.com/&scioq=defi%7Cdecentralized+finance&hl=en&as_sdt=0,5"
0,"R Kumar, S Avasthi, SL Tripathi","Architecture of Blockchain‐Enabled Decentralized Systems",2024,"Decentralized Systems and …","Wiley Online Library","https://onlinelibrary.wiley.com/doi/abs/10.1002/9781394205127.ch3","",744,"2024-07-30 23:13:48","","10.1002/9781394205127.ch3","","",,,,,0,0.00,0,3,1,"… Let us take the example of Decentralized Finance (DeFi), a new innovation in the field of … DeFi now emerged as the new paradigm in the finance industry, offering a range of financial …","","https://scholar.google.com/scholar?q=related:eE8X18faZFwJ:scholar.google.com/&scioq=defi%7Cdecentralized+finance&hl=en&as_sdt=0,5"
2,"T Bitterli, F Schär","Decentralized exchanges: The profitability frontier of constant product market makers",2023,"2023 IEEE International Conference on …","ieeexplore.ieee.org","https://ieeexplore.ieee.org/abstract/document/10174947/","https://scholar.google.com/scholar?cites=15847113324139045456&as_sdt=2005&sciodt=0,5&hl=en",745,"2024-07-30 23:13:48","","","","",,,,,2,2.00,1,2,1,"… Schär, “Decentralized finance: On blockchain- and smart contract-based financial markets,” … Monga, “Decentralised finance and automated market making: Predictable loss and optimal …","https://arxiv.org/pdf/2302.05219","https://scholar.google.com/scholar?q=related:UOKqUJtB7NsJ:scholar.google.com/&scioq=defi%7Cdecentralized+finance&hl=en&as_sdt=0,5"
14,"W Ding, J Li, R Qin, R Kozma, ...","A new architecture and mechanism for decentralized science metamarkets",2023,"IEEE Transactions on …","ieeexplore.ieee.org","https://ieeexplore.ieee.org/abstract/document/10123021/","https://scholar.google.com/scholar?cites=13132391478865746334&as_sdt=2005&sciodt=0,5&hl=en",746,"2024-07-30 23:13:48","","","","",,,,,14,14.00,3,5,1,"… Ross, “How decentralized is the governance of blockchain-based Finance: Empirical evidence from four governance token distributions,” 2021, arXiv:2102.10096. [57] S. Scharnowski …","","https://scholar.google.com/scholar?q=related:ntkovXigP7YJ:scholar.google.com/&scioq=defi%7Cdecentralized+finance&hl=en&as_sdt=0,5"
2,"L Cetara","Protected Areas: Opportunities for Decentralized Financial Mechanisms?",2015,"Nature Policies and Landscape Policies: Towards an …","Springer","https://link.springer.com/chapter/10.1007/978-3-319-05410-0_43","https://scholar.google.com/scholar?cites=8547247254173137454&as_sdt=2005&sciodt=0,5&hl=en",747,"2024-07-30 23:13:48","","10.1007/978-3-319-05410-0_43","","",,,,,2,0.22,2,1,9,"… argument”: many decentralized sources can build a diverse, … Decentralized institutions enjoying greater freedom in action are … of decentralized sources of finance in Romanian PAs. …","","https://scholar.google.com/scholar?q=related:LjpsqBfsnXYJ:scholar.google.com/&scioq=defi%7Cdecentralized+finance&hl=en&as_sdt=0,5"
287,"S Ahluwalia, RV Mahto, M Guerrero","Blockchain technology and startup financing: A transaction cost economics perspective",2020,"Technological Forecasting and Social …","Elsevier","https://www.sciencedirect.com/science/article/pii/S0040162519302586","https://scholar.google.com/scholar?cites=14209915866240977591&as_sdt=2005&sciodt=0,5&hl=en",748,"2024-07-30 23:13:48","","","","",,,,,287,71.75,96,3,4,"… ) and transaction costs associated with startup financing are high and often unsurmountable. … -based decentralized system can alleviate these problems in the area of startup financing. …","https://nrl.northumbria.ac.uk/id/eprint/41752/1/TFSC.pdf","https://scholar.google.com/scholar?q=related:twp7ZzHDM8UJ:scholar.google.com/&scioq=defi%7Cdecentralized+finance&hl=en&as_sdt=0,5"
0,"P Verma, DM Ratnani, S Verma, ...","Decentralized System in Education and Research",2024,"Decentralized Systems …","Wiley Online Library","https://onlinelibrary.wiley.com/doi/abs/10.1002/9781394205127.ch2","",749,"2024-07-30 23:13:48","","10.1002/9781394205127.ch2","","",,,,,0,0.00,0,4,1,"… Figure 2.3 depicts the centralized and decentralized approaches in education system. • According to recent finance agency mechanisms, more decentralized systems tend to give a …","","https://scholar.google.com/scholar?q=related:KPCKpCUK27EJ:scholar.google.com/&scioq=defi%7Cdecentralized+finance&hl=en&as_sdt=0,5"
3,"R Andersson, B Söderberg","Financing roads and railways with decentralized real estate taxes: the case of Sweden",2012,"The annals of regional science","Springer","https://link.springer.com/article/10.1007/s00168-009-0348-x","https://scholar.google.com/scholar?cites=3286028904627412233&as_sdt=2005&sciodt=0,5&hl=en",750,"2024-07-30 23:13:48","","10.1007/s00168-009-0348-x","","",,,,,3,0.25,2,2,12,"… new regional order for financing projects: government expenditures for transportation projects should be transferred to regions as well as the real estate tax to finance them. We present …","","https://scholar.google.com/scholar?q=related:CZ377eBRmi0J:scholar.google.com/&scioq=defi%7Cdecentralized+finance&hl=en&as_sdt=0,5"
35,"PB Spahn","Decentralized government and macroeconomic control",1998,"… Congress of the International Institute of Public Finance","Springer","https://link.springer.com/chapter/10.1007/978-4-431-67939-4_8","https://scholar.google.com/scholar?cites=9225337251362359677&as_sdt=2005&sciodt=0,5&hl=en",751,"2024-07-30 23:13:48","","10.1007/978-4-431-67939-4_8","","",,,,,35,1.35,35,1,26,"… the benefits of decentralized government are usually unquestioned (see. however. Tanzi … This is because local accountability calls not only for decentralized decision-making; it typically …","https://documents1.worldbank.org/curated/en/370061468314988622/pdf/383290ove.pdf","https://scholar.google.com/scholar?q=related:fcmhKFr7BoAJ:scholar.google.com/&scioq=defi%7Cdecentralized+finance&hl=en&as_sdt=0,5"
0,"N Remolina","The Regulatory and Legal Issues of Decentralized Finance",2022,"Singapore Management University School of Law …","papers.ssrn.com","https://papers.ssrn.com/sol3/papers.cfm?abstract_id=4243544","",752,"2024-07-30 23:13:48","","","","",,,,,0,0.00,0,1,2,"… This paper discusses the concept of DeFi and how it challenges the traditional … decentralized applications. Subsequently, the paper analyzes the opportunities and challenges of DeFi …","","https://scholar.google.com/scholar?q=related:y4S_p3WtmuYJ:scholar.google.com/&scioq=defi%7Cdecentralized+finance&hl=en&as_sdt=0,5"
0,"R OZCAN, M Turgut, A Napari","Choosing solitude in turmoil, herding in the decentralized finance (DeFi) token market: An international perspective",2022,"… Journal of Asian Finance …","scholar.kyobobook.co.kr","https://scholar.kyobobook.co.kr/article/detail/4010036922454","",753,"2024-07-30 23:13:48","","","","",,,,,0,0.00,0,3,2,"… Decentralized Finance (DeFi) Tokens market. This is accomplished by using daily returns of 22 DeFi … The results fail to provide any evidence of herding in the DeFi token market on …","","https://scholar.google.com/scholar?q=related:ev3IMUZcIwUJ:scholar.google.com/&scioq=defi%7Cdecentralized+finance&hl=en&as_sdt=0,5"
3,"D Florysiak","Utility tokens, markets in crypto assets regulation (MiCAR), and the costs of being public",2024,"The Elgar Companion to Decentralized Finance …","elgaronline.com","https://www.elgaronline.com/edcollchap/book/9781035307760/book-part-9781035307760-11.xml","https://scholar.google.com/scholar?cites=17284829960070178597&as_sdt=2005&sciodt=0,5&hl=en",754,"2024-07-30 23:13:48","","","","",,,,,3,3.00,3,1,1,"… consumers and investors provides a way to finance the platform development. The market … or decentralized crypto exchanges. This activity has spurred the growth of financing the …","","https://scholar.google.com/scholar?q=related:JScDDUUN4O8J:scholar.google.com/&scioq=defi%7Cdecentralized+finance&hl=en&as_sdt=0,5"
11,"H Park, I Ureta, B Kim","Trend analysis of decentralized autonomous organization using big data analytics",2023,"Information","mdpi.com","https://www.mdpi.com/2078-2489/14/6/326","https://scholar.google.com/scholar?cites=5193684434735457350&as_sdt=2005&sciodt=0,5&hl=en",755,"2024-07-30 23:13:48","HTML","","","",,,,,11,11.00,4,3,1,"Decentralized Autonomous Organizations (DAOs) have gained widespread attention in academia and industry as potential future models for decentralized … related to finance, gaming, …","https://www.mdpi.com/2078-2489/14/6/326","https://scholar.google.com/scholar?q=related:RuTh33msE0gJ:scholar.google.com/&scioq=defi%7Cdecentralized+finance&hl=en&as_sdt=0,5"
2,"T Walters, N Rai, S Esterly, S Cox, T Reber, ...","… . Executive summary; volume 1, engaging the private sector in expanding access to electricity; volume 2, case studies to public-private models to finance decentralized …",2015,"","osti.gov","https://www.osti.gov/biblio/1225524","https://scholar.google.com/scholar?cites=16877399037778321958&as_sdt=2005&sciodt=0,5&hl=en",756,"2024-07-30 23:13:48","","","","",,,,,2,0.22,0,6,9,"… From solar lighting to minigrids, decentralized energy can provide … and “decentralized energy” refer to electricity generation that occurs on-site or near the load it serves. A decentralized …","https://www.osti.gov/servlets/purl/1225524","https://scholar.google.com/scholar?q=related:JuJLKwGROOoJ:scholar.google.com/&scioq=defi%7Cdecentralized+finance&hl=en&as_sdt=0,5"
17,"A Khaki, M Prasad, S Al-Mohamad, W Bakry, ...","Re-evaluating portfolio diversification and design using cryptocurrencies: Are decentralized cryptocurrencies enough?",2023,"… Business and Finance","Elsevier","https://www.sciencedirect.com/science/article/pii/S0275531922002094","https://scholar.google.com/scholar?cites=3440993877232342499&as_sdt=2005&sciodt=0,5&hl=en",757,"2024-07-30 23:13:48","","","","",,,,,17,17.00,3,5,1,"… of centralized and decentralized cryptocurrencies across … Moreover, we find that decentralized cryptocurrencies offer … , Chainlink, and Ethereum (all decentralized) offer the highest …","","https://scholar.google.com/scholar?q=related:41W6PrPdwC8J:scholar.google.com/&scioq=defi%7Cdecentralized+finance&hl=en&as_sdt=0,5"
4,"D Plaatjies","Decentralized co-operative governance of the public health system in South Africa",2008,"","wiredspace.wits.ac.za","https://wiredspace.wits.ac.za/items/eb39043e-6f3e-4aa8-9d19-4b1e1d4ed6b3","https://scholar.google.com/scholar?cites=10789671763313246459&as_sdt=2005&sciodt=0,5&hl=en",758,"2024-07-30 23:13:48","","","","",,,,,4,0.25,4,1,16,"… The design of the decentralized co-operative … finance and health sectors, as a case study or lens through which policy design and implementation is examined within a decentralized …","","https://scholar.google.com/scholar?q=related:-0BZd02dvJUJ:scholar.google.com/&scioq=defi%7Cdecentralized+finance&hl=en&as_sdt=0,5"
44,"P Kondor, G Pintér","Clients' Connections: Measuring the Role of Private Information in Decentralized Markets",2022,"The journal of finance","Wiley Online Library","https://onlinelibrary.wiley.com/doi/abs/10.1111/jofi.13087","https://scholar.google.com/scholar?cites=6978622187582691447&as_sdt=2005&sciodt=0,5&hl=en",759,"2024-07-30 23:13:48","","10.1111/jofi.13087","","",,,,,44,22.00,22,2,2,"We propose a new measure of private information in decentralized markets—connections—which exploits the time variation in the number of dealers with whom a client trades in a time …","https://eprints.lse.ac.uk/110861/1/Gilts_dec_JF_accepted.pdf","https://scholar.google.com/scholar?q=related:d5iGwOcL2WAJ:scholar.google.com/&scioq=defi%7Cdecentralized+finance&hl=en&as_sdt=0,5"
455,"JJ Wallis, WE Oates","Decentralization in the public sector: An empirical study of state and local government",1988,"Fiscal federalism: Quantitative studies","degruyter.com","https://www.degruyter.com/document/doi/10.7208/9780226726236-005/pdf?licenseType=restricted","https://scholar.google.com/scholar?cites=12010933692695240954&as_sdt=2005&sciodt=0,5&hl=en",760,"2024-07-30 23:13:48","","10.7208/9780226726236-005","","",,,,,455,12.64,228,2,36,"… the existing theory of decentralized fiscal choice can explain … welfare gains from a more decentralized public sector and then … potential welfare gains from decentralized finance to remain …","https://www.nber.org/system/files/chapters/c7882/c7882.pdf","https://scholar.google.com/scholar?q=related:-uDejY5or6YJ:scholar.google.com/&scioq=defi%7Cdecentralized+finance&hl=en&as_sdt=0,5"
296,"JS Hacker","Dismantling the health care state? Political institutions, public policies and the comparative politics of health reform",2004,"British Journal of Political Science","cambridge.org","https://www.cambridge.org/core/journals/british-journal-of-political-science/article/reviewarticle-dismantling-the-health-care-state-political-institutions-public-policies-and-thecomparative-politics-of-health-reform/519DC27FFAADA8F07CF3038D497F5EA4","https://scholar.google.com/scholar?cites=15996659332309422632&as_sdt=2005&sciodt=0,5&hl=en",761,"2024-07-30 23:13:48","","","","",,,,,296,14.80,296,1,20,"… medical financing (Britain), (2) centralized decision making coupled … decentralized financing (the Netherlands), (3) decentralized decision making coupled with decentralized financing …","https://www.fpzg.unizg.hr/_download/repository/Hacker2004.pdf","https://scholar.google.com/scholar?q=related:KJI9p-iM_90J:scholar.google.com/&scioq=defi%7Cdecentralized+finance&hl=en&as_sdt=0,5"
42,"S Aramonte, S Doerr, W Huang, A Schrimpf","DeFi lending: intermediation without information?",2022,"","ideas.repec.org","https://ideas.repec.org/p/bis/bisblt/57.html","https://scholar.google.com/scholar?cites=14738975573244920351&as_sdt=2005&sciodt=0,5&hl=en",762,"2024-07-30 23:13:48","","","","",,,,,42,21.00,11,4,2,"… a key part of the decentralised finance (DeFi) ecosystem, but … , overcollateralisation is pervasive in DeFi lending, which … For DeFi lending to make inroads into the real economy, it …","","https://scholar.google.com/scholar?q=related:H0JshDFci8wJ:scholar.google.com/&scioq=defi%7Cdecentralized+finance&hl=en&as_sdt=0,5"
1,"HT Tien, NMB Dang, NT Hung","An empirical analysis of the dynamic impact of DeFi on GCC foreign exchange forward markets: portfolio implication",2024,"… Islamic and Middle Eastern Finance …","emerald.com","https://www.emerald.com/insight/content/doi/10.1108/IMEFM-06-2023-0228/full/html","https://scholar.google.com/scholar?cites=14708347869518946702&as_sdt=2005&sciodt=0,5&hl=en",763,"2024-07-30 23:13:48","","10.1108/IMEFM-06-2023-0228","","",,,,,1,1.00,0,3,1,"… for modeling the associations between DeFi and currency markets is amply apparent. In addition, the present study is the first to highlight the interplay between DeFi and GCC foreign …","","https://scholar.google.com/scholar?q=related:juGMi3WMHswJ:scholar.google.com/&scioq=defi%7Cdecentralized+finance&hl=en&as_sdt=0,5"
0,"P Dylan-Ennis","Hash, Bash, Cash: How Change Happens in Decentralized Web3 Cultures",2024,"Defining Web3: A Guide to the New Cultural …","emerald.com","https://www.emerald.com/insight/content/doi/10.1108/S0733-558X20240000089007/full/html","",764,"2024-07-30 23:13:48","","10.1108/S0733-558X20240000089007","","",,,,,0,0.00,0,1,1,"… traits of a pure DeFi project, arguably even its paradigmatic case. It allows for permissionless finance, its community believe that this is to be achieved in a decentralized manner, its lore …","","https://scholar.google.com/scholar?q=related:huqklhxb698J:scholar.google.com/&scioq=defi%7Cdecentralized+finance&hl=en&as_sdt=0,5"
80,"J Martinez-Vazquez, A Timofeev","Choosing between centralized and decentralized models of tax administration",2013,"Public Sector Reform in …","taylorfrancis.com","https://www.taylorfrancis.com/chapters/edit/10.4324/9780203722220-3/choosing-centralized-decentralized-models-tax-administration-jorge-martinez-vazquez-andrey-timofeev","https://scholar.google.com/scholar?cites=7461897009864394901&as_sdt=2005&sciodt=0,5&hl=en",765,"2024-07-30 23:13:48","","10.4324/9780203722220-3","","",,,,,80,7.27,40,2,11,"… a decentralized system of finance and more generally with the … in the design of a decentralized system of finance that is the … The assignment of taxes in a decentralized system of finance …","https://www.academia.edu/download/41616346/Choosing_between_Centralized_and_Decentr20160127-32279-1leyu83.pdf","https://scholar.google.com/scholar?q=related:lUiEr8v7jWcJ:scholar.google.com/&scioq=defi%7Cdecentralized+finance&hl=en&as_sdt=0,5"
1,"H Park, I Ureta, B Kim","Developing Dimensions and Indicators to Measure Decentralization in Decentralized Autonomous Organizations",2023,"Administrative Sciences","mdpi.com","https://www.mdpi.com/2076-3387/13/11/241","https://scholar.google.com/scholar?cites=1621565055533226647&as_sdt=2005&sciodt=0,5&hl=en",766,"2024-07-30 23:13:48","HTML","","","",,,,,1,1.00,0,3,1,"… various industries utilizing DAOs, including finance, supply-chain … shifts in how blockchain and decentralized technologies are … of decentralized finance (DeFi) protocols or decentralized …","https://www.mdpi.com/2076-3387/13/11/241","https://scholar.google.com/scholar?q=related:l5o-m9P0gBYJ:scholar.google.com/&scioq=defi%7Cdecentralized+finance&hl=en&as_sdt=0,5"
2,"P Bai, C Bisht","Decentralized Identity Management: Prerequisiteof Web3 Identity Model",2023,"Authorea Preprints","techrxiv.org","https://www.techrxiv.org/doi/full/10.36227/techrxiv.20424633.v1","https://scholar.google.com/scholar?cites=14499735119554958201&as_sdt=2005&sciodt=0,5&hl=en",767,"2024-07-30 23:13:48","","10.36227/techrxiv.20424633.v1","","",,,,,2,2.00,1,2,1,"… Defi is an advanced technological evolution in global finance after joining finance technology, regulatory technology, cryptocurrency, and digital assets. Defi uses one or more …","https://www.techrxiv.org/doi/pdf/10.36227/techrxiv.20424633.v1","https://scholar.google.com/scholar?q=related:eVNUskRoOckJ:scholar.google.com/&scioq=defi%7Cdecentralized+finance&hl=en&as_sdt=0,5"
5,"Z Chen, G Yang","Decentralized custody scheme with game-theoretic security",2020,"arXiv preprint arXiv:2008.10895","","","https://scholar.google.com/scholar?cites=10093140085426073712&as_sdt=2005&sciodt=0,5&hl=en",768,"2024-07-30 23:13:48","CITATION","","","",,,,,5,1.25,3,2,4,"","","https://scholar.google.com/scholar?q=related:cLATlG4JEowJ:scholar.google.com/&scioq=defi%7Cdecentralized+finance&hl=en&as_sdt=0,5"
35,"Y Xiao, S Shi, W Lou, C Wang, X Li, ...","Decentralized spectrum access system: Vision, challenges, and a blockchain solution",2022,"IEEE Wireless …","ieeexplore.ieee.org","https://ieeexplore.ieee.org/abstract/document/9679805/","https://scholar.google.com/scholar?cites=8829818938755793658&as_sdt=2005&sciodt=0,5&hl=en",769,"2024-07-30 23:13:48","","","","",,,,,35,17.50,6,6,2,"… wide adoption in novel business scenarios, such as decentralized finance, digital identity, and supply chain management. The decentralized and zero-trust nature, consensus-based …","https://arxiv.org/pdf/2112.05612","https://scholar.google.com/scholar?q=related:-kKO24rRiXoJ:scholar.google.com/&scioq=defi%7Cdecentralized+finance&hl=en&as_sdt=0,5"
27,"A Meleg","SISAR: a sustainable management model for small rural decentralized water and wastewater systems in developing countries",2012,"Journal of Water, Sanitation and Hygiene for …","iwaponline.com","https://iwaponline.com/washdev/article-abstract/2/4/291/29811","https://scholar.google.com/scholar?cites=17419018125983204131&as_sdt=2005&sciodt=0,5&hl=en",770,"2024-07-30 23:13:48","","","","",,,,,27,2.25,27,1,12,"… Important stakeholders in the model include, besides the users, local and state government and international financing institutions responsible for financing the investments in the …","","https://scholar.google.com/scholar?q=related:I8NRF7LIvPEJ:scholar.google.com/&scioq=defi%7Cdecentralized+finance&hl=en&as_sdt=0,5"
1,"M Mörke","Campbell R. Harvey, Ashwin Ramachandran, Joey Santoro: DeFi and the Future of Finance: Wiley, 2021, 187 pages, USD 26.95, approx. EUR 25, ISBN: 978-1-119 …",2023,"","Springer","https://link.springer.com/article/10.1007/s11408-022-00418-7","https://scholar.google.com/scholar?cites=11552753364852582250&as_sdt=2005&sciodt=0,5&hl=en",771,"2024-07-30 23:13:48","","10.1007/s11408-022-00418-7","","",,,,,1,1.00,1,1,1,"… as an excellent overview of decentralized finance. In summary, DeFi and the Future of Finance is a very intuitive and comprehensive introduction to decentralized finance. I regard this to …","","https://scholar.google.com/scholar?q=related:aqe86fmfU6AJ:scholar.google.com/&scioq=defi%7Cdecentralized+finance&hl=en&as_sdt=0,5"
11,"J Martínez-Vázquez, A Timofeev","Capital infrastructure and equity objectives in decentralized systems",2015,"… and Infrastructure in the Global …","taylorfrancis.com","https://www.taylorfrancis.com/chapters/edit/10.4324/9781315694108-8/capital-infrastructure-equity-objectives-decentralized-systems-jorge-mart%C3%ADnez-v%C3%A1zquez-andrey-timofeev","https://scholar.google.com/scholar?cites=8424961982025057664&as_sdt=2005&sciodt=0,5&hl=en",772,"2024-07-30 23:13:48","","10.4324/9781315694108-8/capital-infrastructure-equity-objectives-decentralized-systems-jorge-mart%C3%ADnez-v%C3%A1zquez-andrey-timofeev","","",,,,,11,1.22,6,2,9,"… the “adequate” financing of decentralized functions, it is easy … decentralized systems the need to provide equal financing … recurrent expenditures needed to finance those public services. …","https://scholarworks.gsu.edu/cgi/viewcontent.cgi?article=1022&context=icepp","https://scholar.google.com/scholar?q=related:gEXGCEl663QJ:scholar.google.com/&scioq=defi%7Cdecentralized+finance&hl=en&as_sdt=0,5"
3,"C Alexander, X Chen, J Deng, Q Fu","Market efficiency improvements from technical developments of decentralized crypto exchanges",2023,"Available at SSRN 4495589","papers.ssrn.com","https://papers.ssrn.com/sol3/papers.cfm?abstract_id=4495589","https://scholar.google.com/scholar?cites=2410607270236953379&as_sdt=2005&sciodt=0,5&hl=en",773,"2024-07-30 23:13:48","","","","",,,,,3,3.00,1,4,1,"… This paper adds to the finance literature by investigating the … the numeraire for decentralised finance, being the unit for gas … about 60% of the entire decentralized trading volume (see the …","https://www.researchgate.net/profile/Jun-Deng-20/publication/371957448_Market_Efficiency_Improvements_from_Technical_Developments_of_Decentralized_Crypto_Exchanges/links/649e9c9fb9ed6874a5ea7cf3/Market-Efficiency-Improvements-from-Technical-Developments-of-Decentralized-Crypto-Exchanges.pdf","https://scholar.google.com/scholar?q=related:I5tyU4oydCEJ:scholar.google.com/&scioq=defi%7Cdecentralized+finance&hl=en&as_sdt=0,5"
0,"MFA Gadi, M Schmidt, N Ruemmele, ...","An empirical approach and practical framework for a decentralized Ethereum Ecosystem Index (EEI)",2024,"PeerJ Computer …","peerj.com","https://peerj.com/articles/cs-1766/","",774,"2024-07-30 23:13:48","HTML","","","",,,,,0,0.00,0,4,1,"… Such an index functions as a reliable reference, indicating the direction for investors who aspire to explore the novel territory of decentralized finance (DeFi) as well as the Ethereum …","https://peerj.com/articles/cs-1766/","https://scholar.google.com/scholar?q=related:sNMGED2aa9gJ:scholar.google.com/&scioq=defi%7Cdecentralized+finance&hl=en&as_sdt=0,5"
0,"I Qabrati, E Tafili","Decentralized Insurance Innovations in Risk Management",2024,"Decentralized Finance and Tokenization in …","igi-global.com","https://www.igi-global.com/chapter/decentralized-insurance-innovations-in-risk-management/349442","",775,"2024-07-30 23:13:48","","","","",,,,,0,0.00,0,2,1,"… This chapter explores the exciting area of decentralized … , smart contracts and decentralized finance (DeFi) are redefining … Discover how decentralized insurance is changing the …","","https://scholar.google.com/scholar?q=related:3iYv4lMjGFQJ:scholar.google.com/&scioq=defi%7Cdecentralized+finance&hl=en&as_sdt=0,5"
